Symbol,Name,Last Sale,Net Change,% Change,Market Cap,Country,IPO Year,Volume,Sector,Industry
IMVT,Immunovant Inc. Common Stock,$10.51,0.59,5.948%,859841251.00,United States,2019,1949985,Health Care,Major Pharmaceuticals
IMXI,International Money Express Inc. Common Stock,$15.435,-0.315,-2.00%,604173563.00,United States,2017,57513,Technology,EDP Services
INBK,First Internet Bancorp Common Stock,$33.82,0.31,0.925%,333262348.00,United States,,2993,Finance,Major Banks
INBKL,First Internet Bancorp 6.0% Fixed-to-Floating Rate Subordinated Notes due 2026,$25.95,0.47,1.845%,0.00,United States,,600,,
INBKZ,First Internet Bancorp 6.0% Fixed-to-Floating Rate Subordinated Notes Due 2029,$26.25,0.00,0.00%,0.00,United States,,483,Finance,Major Banks
INBX,Inhibrx Inc. Common Stock,$20.53,1.08,5.553%,776254718.00,United States,2020,39600,Health Care,Major Pharmaceuticals
INCY,Incyte Corp. Common Stock,$81.79,-0.47,-0.571%,17987541184.00,United States,,210976,Health Care,Biotechnology: Commercial Physical & Biological Resarch
INDB,Independent Bank Corp. Common Stock,$80.84,-0.03,-0.037%,2670222321.00,United States,,21099,Finance,Major Banks
INDT,INDUS Realty Trust Inc. (MD) Common Stock,$65.50,0.00,0.00%,505464679.00,United States,,305,Finance,Real Estate
INFI,Infinity Pharmaceuticals Inc. Common Stock,$3.285,-0.005,-0.152%,291206187.00,United States,,458266,Health Care,Major Pharmaceuticals
INFN,Infinera Corporation Common Stock,$10.015,0.165,1.675%,2053040849.00,United States,2007,1226435,Public Utilities,Telecommunications Equipment
INGN,Inogen Inc Common Stock,$57.77,-0.49,-0.841%,1293779947.00,United States,2014,31605,Health Care,Industrial Specialties
INKA,KludeIn I Acquisition Corp. Class A Common Stock,$9.75,0.00,0.00%,210234375.00,United States,2021,4,,
INKAW,KludeIn I Acquisition Corp. Warrant,$0.66,-0.0168,-2.482%,0.00,United States,2021,1000,Finance,Business Services
INM,InMed Pharmaceuticals Inc. Common Shares,$2.9152,-0.0748,-2.502%,23469421.00,Canada,,8506,,
INMB,INmune Bio Inc. Common stock,$13.28,-0.34,-2.496%,198305433.00,United States,2019,19457,Health Care,Major Pharmaceuticals
INMD,InMode Ltd. Ordinary Shares,$81.20,-2.67,-3.183%,3101097101.00,Israel,2019,292914,Health Care,Medical/Nursing Services
INNV,InnovAge Holding Corp. Common Stock,$21.53,0.51,2.426%,2917670525.00,United States,2021,69307,Health Care,Hospital/Nursing Management
INO,Inovio Pharmaceuticals Inc. Common Stock,$7.865,-0.095,-1.193%,1646925180.00,United States,,3378501,Health Care,Biotechnology: Biological Products (No Diagnostic Substances)
INOD,Innodata Inc. Common Stock,$6.23,-0.07,-1.111%,163953745.00,United States,1993,19744,Technology,EDP Services
INOV,Inovalon Holdings Inc. Class A Common Stock,$30.205,-0.755,-2.439%,4708755435.00,United States,2015,151254,Technology,EDP Services
INPX,Inpixon Common Stock,$1.08,-0.02,-1.818%,120691432.00,United States,2014,1143375,Technology,Computer Software: Prepackaged Software
INSE,Inspired Entertainment Inc. Common Stock,$12.0327,-0.1173,-0.965%,279379115.00,United States,2014,159862,,
INSG,Inseego Corp. Common Stock,$9.545,0.305,3.301%,981469770.00,United States,,1766456,Capital Goods,Telecommunications Equipment
INSM,Insmed Inc. Common Stock,$24.605,-0.885,-3.472%,2829378332.00,United States,,270616,Health Care,Major Pharmaceuticals
INTC,Intel Corporation Common Stock,$56.39,-1.09,-1.896%,227702820000.00,United States,,11068800,Technology,Semiconductors
INTG,Intergroup Corporation (The) Common Stock,$49.3226,9.9126,25.152%,110320550.00,United States,,99530,Consumer Services,Hotels/Resorts
INTU,Intuit Inc. Common Stock,$445.74,0.30,0.067%,121802585227.00,United States,1993,504816,Technology,Computer Software: Prepackaged Software
INTZ,Intrusion Inc. Common Stock,$17.43,-0.81,-4.441%,307116705.00,United States,,108572,Miscellaneous,Diversified Manufacture
INVA,Innoviva Inc. Common Stock,$13.22,-0.09,-0.676%,917504381.00,United States,,147682,Health Care,Major Pharmaceuticals
INVE,Identiv Inc. Common Stock,$14.97,-0.48,-3.107%,329091408.00,United States,,33618,Technology,Computer peripheral equipment
INVO,INVO BioScience Inc. Common Stock,$4.18,0.00,0.00%,43676966.00,United States,,15619,Health Care,Medical/Dental Instruments
INVZ,Innoviz Technologies Ltd. Ordinary shares,$10.48,0.07,0.672%,1360523692.00,Israel,,143839,Capital Goods,Auto Parts:O.E.M.
INVZW,Innoviz Technologies Ltd. Warrant,$2.665,0.00,0.00%,0.00,Israel,,6,Capital Goods,Auto Parts:O.E.M.
INZY,Inozyme Pharma Inc. Common Stock,$16.48,0.14,0.857%,387001373.00,United States,2020,11185,Health Care,Major Pharmaceuticals
IONS,Ionis Pharmaceuticals Inc. Common Stock,$34.87,-0.81,-2.27%,4915380786.00,United States,,339349,Health Care,Major Pharmaceuticals
IOSP,Innospec Inc. Common Stock,$100.85,-0.43,-0.425%,2481741508.00,United States,,35186,Basic Industries,Industrial Specialties
IOVA,Iovance Biotherapeutics Inc. Common Stock,$17.50,-0.78,-4.267%,2674862435.00,United States,,1094738,Health Care,Major Pharmaceuticals
IPA,ImmunoPrecise Antibodies Ltd. Common Stock,$7.16,-0.435,-5.727%,136605640.00,Canada,,29028,,
IPAR,Inter Parfums Inc. Common Stock,$76.56,0.40,0.525%,2423280029.00,United States,,34957,Consumer Non-Durables,Package Goods/Cosmetics
IPDN,Professional Diversity Network Inc. Common Stock,$1.52,-0.04,-2.564%,20466833.00,United States,2013,59308,Technology,EDP Services
IPGP,IPG Photonics Corporation Common Stock,$203.24,-4.00,-1.93%,10889316696.00,United States,2006,58476,Technology,Semiconductors
IPHA,Innate Pharma S.A. ADS,$3.69,-0.05,-1.337%,291432381.00,France,2019,8233,Health Care,Major Pharmaceuticals
IPLDP,Interstate Power & Light Company Perp Prd Ser D,$26.1899,0.0899,0.344%,0.00,United States,,771,Public Utilities,Power Generation
IPVI,InterPrivate IV InfraTech Partners Inc. Class A Common Stock,$9.73,0.00,0.00%,0.00,United States,2021,11,,
IPVIU,InterPrivate IV InfraTech Partners Inc. Units,$9.98,0.03,0.302%,0.00,United States,2021,103906,,
IPVIW,InterPrivate IV InfraTech Partners Inc. Warrant,$0.9206,0.0206,2.289%,0.00,United States,2021,1852,Finance,Business Services
IPW,iPower Inc. Common Stock,$6.32,0.01,0.158%,160960895.00,United States,2021,29630,Consumer Services,Catalog/Specialty Distribution
IPWR,Ideal Power Inc. Common Stock,$11.3659,0.0259,0.228%,66741088.00,United States,2013,22168,Capital Goods,Industrial Machinery/Components
IQ,iQIYI Inc. American Depositary Shares,$13.94,-0.48,-3.329%,11002631618.00,China,2018,4608280,Technology,Internet and Information Services
IRBT,iRobot Corporation Common Stock,$102.098,-3.832,-3.617%,2868442697.00,United States,2005,256533,,
IRCP,IRSA Propiedades Comerciales S.A. American Depositary Shares,$10.7425,0.7225,7.211%,338426478.00,Argentina,,19321,Consumer Services,Building operators
IRDM,Iridium Communications Inc Common Stock,$37.02,-0.99,-2.605%,4941386546.00,United States,,211687,Consumer Services,Telecommunications Equipment
IRIX,IRIDEX Corporation Common Stock,$7.74,-0.15,-1.901%,120943692.00,United States,1996,16428,Health Care,Biotechnology: Electromedical & Electrotherapeutic Apparatus
IRMD,iRadimed Corporation Common Stock,$27.545,0.395,1.455%,339147289.00,United States,2014,713,Health Care,Medical/Dental Instruments
IROQ,IF Bancorp Inc. Common Stock,$22.5852,0.00,0.00%,73184540.00,United States,2011,6,Finance,Finance: Consumer Services
IRTC,iRhythm Technologies Inc. Common Stock,$61.19,-1.58,-2.517%,1793053630.00,United States,2016,351296,Health Care,Medical/Dental Instruments
IRWD,Ironwood Pharmaceuticals Inc. Class A Common Stock,$11.80,0.12,1.027%,1911207497.00,United States,2010,285144,Health Care,Major Pharmaceuticals
ISBC,Investors Bancorp Inc. Common Stock,$14.835,0.065,0.44%,3674186023.00,United States,,607704,Finance,Savings Institutions
ISEE,IVERIC bio Inc. Common Stock,$6.75,-0.04,-0.589%,609222033.00,United States,2013,227357,Health Care,Major Pharmaceuticals
ISIG,Insignia Systems Inc. Common Stock,$7.5621,-0.1479,-1.918%,13264150.00,United States,1991,21755,Technology,Advertising
ISLE,Isleworth Healthcare Acquisition Corporation Common stock,$9.75,0.01,0.103%,0.00,United States,2021,1066,,
ISLEW,Isleworth Healthcare Acquisition Corporation Warrant,$0.6201,0.0182,3.024%,0.00,United States,2021,3363,Consumer Services,Hotels/Resorts
ISNS,Image Sensing Systems Inc. Common Stock,$8.00,0.15,1.911%,42834696.00,United States,1995,101443,Capital Goods,Industrial Machinery/Components
ISRG,Intuitive Surgical Inc. Common Stock,$818.26,-3.28,-0.399%,96892529735.00,United States,2000,130492,Health Care,Medical/Dental Instruments
ISSC,Innovative Solutions and Support Inc. Common Stock,$5.64,-0.04,-0.704%,97244158.00,United States,2000,382,Capital Goods,Military/Government/Technical
ISTR,Investar Holding Corporation Common Stock,$23.26,0.23,0.999%,242214079.00,United States,2014,17725,Finance,Commercial Banks
ISUN,iSun Inc. Common Stock,$9.115,-0.265,-2.825%,82834996.00,United States,2016,87418,Technology,Semiconductors
ITAC,Industrial Tech Acquisitions Inc. Class A common stock,$9.97,-0.03,-0.30%,95009115.00,United States,2020,13354,,
ITACU,Industrial Tech Acquisitions Inc. Unit,$10.80,-0.20,-1.818%,0.00,United States,2020,2310,,
ITACW,Industrial Tech Acquisitions Inc. Warrant,$0.90,0.0736,8.906%,0.00,United States,2020,24922,,
ITCI,Intra-Cellular Therapies Inc. Common Stock,$38.20,-0.08,-0.209%,3101925033.00,United States,,89370,Health Care,Major Pharmaceuticals
ITHX,ITHAX Acquisition Corp. Class A Ordinary Shares,$9.72,0.01,0.103%,299983500.00,United States,2021,980,Finance,Business Services
ITHXU,ITHAX Acquisition Corp. Unit,$9.96,-0.03,-0.30%,0.00,United States,2021,200,Finance,Business Services
ITHXW,ITHAX Acquisition Corp. Warrant,$0.6601,0.0001,0.015%,0.00,United States,2021,152,Finance,Business Services
ITI,Iteris Inc. Common Stock,$6.94,-0.15,-2.116%,288985708.00,United States,,105190,Capital Goods,Telecommunications Equipment
ITIC,Investors Title Company Common Stock,$174.79,0.00,0.00%,331073584.00,United States,,522,Finance,Specialty Insurers
ITMR,Itamar Medical Ltd. American Depository Shares,$18.89,-0.06,-0.317%,309552640.00,Israel,,1708,Health Care,Medical/Dental Instruments
ITOS,iTeos Therapeutics Inc. Common Stock,$19.26,-0.20,-1.028%,676103021.00,United States,2020,197461,Consumer Durables,Specialty Chemicals
ITQ,Itiquira Acquisition Corp. Class A Ordinary Shares,$9.67,0.02,0.207%,0.00,United States,2021,90190,Finance,Business Services
ITQRU,Itiquira Acquisition Corp. Unit,$9.97,0.00,0.00%,0.00,United States,2021,338,Finance,Business Services
ITRI,Itron Inc. Common Stock,$94.58,-1.37,-1.428%,4268642443.00,United States,1993,61558,Capital Goods,Electrical Products
ITRM,Iterum Therapeutics plc Ordinary Share,$1.53,0.02,1.325%,274082317.00,Ireland,2018,4544251,Health Care,Major Pharmaceuticals
ITRN,Ituran Location and Control Ltd. Ordinary Shares,$24.098,-0.102,-0.421%,501559048.00,Israel,2005,6032,Technology,Electronic Components
IVA,Inventiva S.A. American Depository Shares,$13.515,0.125,0.934%,522087977.00,France,2020,3675,Consumer Services,Other Consumer Services
IVAC,Intevac Inc. Common Stock,$6.39,-0.04,-0.622%,154140954.00,United States,1995,22710,,
IZEA,IZEA Worldwide Inc. Common Stock,$2.855,-0.195,-6.393%,176229440.00,United States,,645416,Technology,Advertising
JACK,Jack In The Box Inc. Common Stock,$112.535,-1.395,-1.224%,2501444410.00,United States,,74088,Consumer Services,Restaurants
JAGX,Jaguar Health Inc. Common Stock,$1.8441,0.0241,1.324%,253232332.00,United States,2015,11798470,Health Care,Major Pharmaceuticals
JAKK,JAKKS Pacific Inc. Common Stock,$9.7659,0.6159,6.731%,62460870.00,United States,1996,84474,Consumer Non-Durables,Recreational Products/Toys
JAMF,Jamf Holding Corp. Common Stock,$36.26,0.18,0.499%,4268713286.00,United States,2020,142827,Technology,Computer Software: Prepackaged Software
JAN,JanOne Inc. Common Stock (NV),$7.20,-0.74,-9.32%,20328552.00,United States,,262350,Public Utilities,Environmental Services
JAZZ,Jazz Pharmaceuticals plc Common Stock (Ireland),$171.58,-2.24,-1.289%,10413884927.00,Ireland,2007,147520,Health Care,Major Pharmaceuticals
JBHT,J.B. Hunt Transport Services Inc. Common Stock,$170.205,0.115,0.068%,17985733576.00,United States,,117448,Transportation,Trucking Freight/Courier Services
JBLU,JetBlue Airways Corporation Common Stock,$19.385,-0.535,-2.686%,6138006035.00,United States,2002,3687691,Transportation,Air Freight/Delivery Services
JBSS,John B. Sanfilippo & Son Inc. Common Stock,$92.39,-0.65,-0.699%,1059559748.00,United States,1991,2839,Consumer Non-Durables,Specialty Foods
JCIC,Jack Creek Investment Corp. Class A Ordinary Shares,$9.67,0.02,0.207%,417018750.00,United States,2021,904,Finance,Business Services
JCICU,Jack Creek Investment Corp. Units,$9.97,0.00,0.00%,0.00,United States,2021,920,Finance,Business Services
JCICW,Jack Creek Investment Corp. Warrants,$0.674,0.003,0.447%,0.00,United States,2021,3022,Finance,Business Services
JCOM,j2 Global Inc. Common Stock,$126.30,-0.05,-0.04%,5697670607.00,United States,1999,79237,Technology,Telecommunications Equipment
JCS,Communications Systems Inc. Common Stock,$6.89,0.09,1.324%,64218073.00,United States,,5326,Public Utilities,Telecommunications Equipment
JCTCF,Jewett-Cameron Trading Company Common Shares,$9.99,0.055,0.554%,34856718.00,United States,,307,,
JD,JD.com Inc. American Depositary Shares,$74.94,-1.60,-2.09%,116830355309.00,China,2014,4770568,Miscellaneous,Diversified Commercial Services
JFIN,Jiayin Group Inc. American Depositary Shares,$6.535,-0.295,-4.319%,353053375.00,China,2019,151046,Finance,Finance: Consumer Services
JFU,9F Inc. American Depositary Shares,$1.77,0.01,0.568%,360213905.00,China,2019,901368,Finance,Finance: Consumer Services
JG,Aurora Mobile Limited American Depositary Shares,$3.22,-0.15,-4.451%,379681071.00,China,2018,393456,Technology,EDP Services
JJSF,J & J Snack Foods Corp. Common Stock,$179.03,-0.23,-0.128%,3408009351.00,United States,1986,12987,Consumer Non-Durables,Specialty Foods
JKHY,Jack Henry & Associates Inc. Common Stock,$155.76,0.24,0.154%,11555145162.00,United States,1985,97666,Technology,Retail: Computer Software & Peripheral Equipment
JMPNL,JMP Group LLC 7.25% Senior Notes due 2027,$25.49,0.0016,0.006%,0.00,United States,,373,,
JMPNZ,JMP Group LLC 6.875% Senior Notes due 2029,$25.3301,0.00,0.00%,0.00,United States,,14,Finance,Investment Bankers/Brokers/Service
JNCE,Jounce Therapeutics Inc. Common Stock,$7.75,-0.09,-1.148%,396864767.00,United States,2017,111544,Health Care,Major Pharmaceuticals
JOAN,JOANN Inc. Common Stock,$13.739,0.059,0.431%,556694305.00,United States,2021,101055,Consumer Non-Durables,Department/Specialty Retail Stores
JOBS,51job Inc. American Depositary Shares,$72.855,-0.215,-0.294%,4912826407.00,China,2004,110024,Technology,Diversified Commercial Services
JOFF,JOFF Fintech Acquisition Corp. Class A Common Stock,$9.655,0.005,0.052%,0.00,United States,2021,362,,
JOFFU,JOFF Fintech Acquisition Corp. Unit,$9.92,-0.04,-0.402%,0.00,United States,2021,321,,
JOFFW,JOFF Fintech Acquisition Corp. Warrant,$0.8998,0.00,0.00%,0.00,United States,2021,92,Finance,Business Services
JOUT,Johnson Outdoors Inc. Class A Common Stock,$121.37,-0.51,-0.418%,1228044478.00,United States,,8598,Consumer Non-Durables,Recreational Products/Toys
JRJC,China Finance Online Co. Limited American Depositary Shares,$10.66,0.50,4.921%,26031294.00,China,2004,37468,Finance,Investment Bankers/Brokers/Service
JRSH,Jerash Holdings (US) Inc. Common Stock,$6.29,0.00,0.00%,71234250.00,United States,2018,867,Basic Industries,Industrial Specialties
JRVR,James River Group Holdings Ltd. Common Shares,$36.02,-0.02,-0.055%,1342552929.00,Bermuda,2014,93944,Finance,Property-Casualty Insurers
JSM,Navient Corporation 6% Senior Notes due December 15 2043,$25.42,-0.04,-0.157%,0.00,United States,,2512,Finance,Finance: Consumer Services
JUPW,Jupiter Wellness Inc. Common Stock,$4.47,-0.07,-1.542%,51003540.00,United States,2020,68287,Health Care,Major Pharmaceuticals
JUPWW,Jupiter Wellness Inc. Warrant,$1.57,0.07,4.667%,0.00,United States,2020,3306,Health Care,Major Pharmaceuticals
JVA,Coffee Holding Co. Inc. Common Stock,$6.00,-0.04,-0.662%,34251594.00,United States,2005,29125,Consumer Non-Durables,Specialty Foods
JWEL,Jowell Global Ltd. Ordinary Shares,$6.90,-0.0775,-1.111%,175403893.00,China,2021,22087,Consumer Services,Other Consumer Services
JYAC,Jiya Acquisition Corp. Class A Common Stock,$9.85,-0.04,-0.404%,132453846.00,United States,2020,1893,,
JYNT,The Joint Corp. Common Stock,$71.15,-0.49,-0.684%,1012229705.00,United States,2014,263568,,
JZXN,Jiuzi Holdings Inc. Ordinary Shares,$10.9262,1.6162,17.36%,220709240.00,China,2021,3508967,Consumer Durables,Automotive Aftermarket
KAIIU,Kismet Acquisition Two Corp. Unit,$9.91,-0.04,-0.402%,0.00,United States,2021,400,Finance,Business Services
KAIIW,Kismet Acquisition Two Corp. Warrant,$0.685,0.00,0.00%,0.00,United States,2021,10,Finance,Business Services
KAIR,Kairos Acquisition Corp. Class A Ordinary Shares,$9.6839,-0.0661,-0.678%,334094550.00,United States,2021,111,Finance,Business Services
KAIRU,Kairos Acquisition Corp. Unit,$9.98,-0.12,-1.188%,0.00,United States,2021,450,Finance,Business Services
KAIRW,Kairos Acquisition Corp. Warrant,$0.629,-0.041,-6.119%,0.00,United States,2021,2619,Finance,Business Services
KALA,Kala Pharmaceuticals Inc. Common Stock,$5.66,0.06,1.071%,317298836.00,United States,2017,1000578,Health Care,Major Pharmaceuticals
KALU,Kaiser Aluminum Corporation Common Stock,$133.69,0.19,0.142%,2118710831.00,United States,,29054,Basic Industries,Aluminum
KALV,KalVista Pharmaceuticals Inc. Common Stock,$26.36,-0.28,-1.051%,643784191.00,United Kingdom,2015,34920,Health Care,Major Pharmaceuticals
KARO,Karooooo Ltd. Ordinary Shares,$37.30,-0.05,-0.134%,803456696.00,Singapore,2021,3681,Technology,Computer Software: Prepackaged Software
KBAL,Kimball International Inc. Class B Common Stock,$13.78,0.10,0.731%,506894020.00,United States,,24867,Consumer Durables,Industrial Specialties
KBNT,Kubient Inc. Common Stock,$5.12,-0.21,-3.94%,71590252.00,United States,2020,95930,Technology,EDP Services
KBNTW,Kubient Inc. Warrant,$1.70,-0.16,-8.602%,0.00,United States,2020,450,Technology,EDP Services
KBSF,KBS Fashion Group Limited Common Stock,$3.28,0.03,0.923%,8499461.00,China,2013,22123,Consumer Non-Durables,Apparel
KC,Kingsoft Cloud Holdings Limited American Depositary Shares,$39.035,-1.415,-3.498%,8717463543.00,China,2020,440451,Technology,Computer Software: Prepackaged Software
KDMN,Kadmon Holdings Inc. Common Stock,$3.66,-0.09,-2.40%,629424342.00,United States,,412145,Health Care,Major Pharmaceuticals
KDNY,Chinook Therapeutics Inc. Common Stock,$16.395,-0.145,-0.877%,731484173.00,United States,2015,21249,Health Care,Major Pharmaceuticals
KDP,Keurig Dr Pepper Inc. Common Stock,$36.865,-0.185,-0.499%,52252072102.00,United States,,1117413,Consumer Non-Durables,Beverages (Production/Distribution)
KE,Kimball Electronics Inc. Common Stock,$21.62,-0.23,-1.053%,539571659.00,United States,,15048,Capital Goods,Industrial Machinery/Components
KELYA,Kelly Services Inc. Class A Common Stock,$25.26,-0.12,-0.473%,994462102.00,United States,,37238,Technology,Diversified Commercial Services
KELYB,Kelly Services Inc. Class B Common Stock,$25.12,0.02,0.08%,988950436.00,United States,,920,Technology,Diversified Commercial Services
KEQU,Kewaunee Scientific Corporation Common Stock,$11.73,-0.22,-1.841%,32407609.00,United States,,4372,Capital Goods,Medical Specialities
KERN,Akerna Corp. Common Stock,$4.25,-0.26,-5.765%,59749505.00,United States,2018,1297848,Health Care,Managed Health Care
KERNW,Akerna Corp Warrant,$1.2182,-0.0018,-0.148%,0.00,United States,2018,6801,,
KFFB,Kentucky First Federal Bancorp Common Stock,$7.17,-0.0098,-0.136%,58985547.00,United States,,1037,Finance,Savings Institutions
KFRC,Kforce Inc. Common Stock,$62.51,-0.23,-0.367%,1369902649.00,United States,1995,12292,Technology,Diversified Commercial Services
KHC,The Kraft Heinz Company Common Stock,$43.855,-0.235,-0.533%,53641126596.00,United States,,994388,Consumer Non-Durables,Farming/Seeds/Milling
KIDS,OrthoPediatrics Corp. Common Stock,$59.47,1.71,2.961%,1169121741.00,United States,2017,27424,Health Care,Medical/Dental Instruments
KIII,Kismet Acquisition Three Corp. Class A Ordinary Shares,$9.74,-0.02,-0.205%,354901250.00,United States,2021,550,Finance,Business Services
KIIIU,Kismet Acquisition Three Corp. Unit,$9.94,0.00,0.00%,0.00,United States,2021,1,Finance,Business Services
KIIIW,Kismet Acquisition Three Corp. Warrant,$0.6144,0.00,0.00%,0.00,United States,2021,10,Finance,Business Services
KIN,Kindred Biosciences Inc. Common Stock,$6.579,1.139,20.938%,297854383.00,United States,2013,892024,Health Care,Major Pharmaceuticals
KINS,Kingstone Companies Inc. Common Stock,$8.00,-0.06,-0.744%,85445224.00,United States,,1049,Finance,Specialty Insurers
KINZ,KINS Technology Group Inc. Class A Common Stock,$9.86,-0.0275,-0.278%,340170000.00,United States,2021,2400,,
KINZU,KINS Technology Group Inc. Unit,$10.38,0.00,0.00%,0.00,United States,2020,35,,
KINZW,KINS Technology Group Inc. Warrant,$0.7901,-0.0124,-1.545%,0.00,United States,2021,5241,Finance,Business Services
KIRK,Kirkland's Inc. COMMONSTOCK,$23.27,-0.73,-3.042%,332491464.00,United States,2002,244510,Miscellaneous,Diversified Commercial Services
KLAC,KLA Corporation Common Stock,$311.19,-4.40,-1.394%,47699758052.00,United States,1980,647569,Capital Goods,Electronic Components
KLAQ,KL Acquisition Corp Class A Common Stock,$9.71,-0.02,-0.206%,348953125.00,United States,2021,440,,
KLAQU,KL Acquisition Corp Unit,$9.9636,0.00,0.00%,0.00,United States,2021,3,,
KLAQW,KL Acquisition Corp Warrant,$0.7502,-0.0698,-8.512%,0.00,United States,2021,665,Finance,Business Services
KLDO,Kaleido Biosciences Inc. Common Stock,$6.96,-0.27,-3.734%,295929825.00,United States,2019,31156,Health Care,Biotechnology: Biological Products (No Diagnostic Substances)
KLIC,Kulicke and Soffa Industries Inc. Common Stock,$51.745,-0.895,-1.70%,3210960117.00,Singapore,,165725,Technology,Semiconductors
KLXE,KLX Energy Services Holdings Inc. Common Stock,$14.4399,-0.5901,-3.926%,127491855.00,United States,,103723,Energy,Oilfield Services/Equipment
KMDA,Kamada Ltd. Ordinary Shares,$5.91,-0.09,-1.50%,264445101.00,Israel,2013,9699,Health Care,Major Pharmaceuticals
KMPH,KemPharm Inc. Common Stock,$10.80,0.16,1.504%,307878808.00,United States,,236352,Health Care,Major Pharmaceuticals
KNBE,KnowBe4 Inc. Class A Common Stock,$19.77,0.01,0.051%,3354422063.00,United States,2021,52099,Technology,Computer Software: Prepackaged Software
KNDI,Kandi Technologies Group Inc Common Stock,$5.695,-0.055,-0.957%,429332126.00,China,,665340,Capital Goods,Auto Parts:O.E.M.
KNSA,Kiniksa Pharmaceuticals Ltd. Class A Common Stock,$13.35,0.05,0.376%,912232654.00,United States,2018,65651,Health Care,Major Pharmaceuticals
KNSL,Kinsale Capital Group Inc. Common Stock,$161.9868,-0.2132,-0.131%,3695277871.00,United States,2016,20653,Finance,Property-Casualty Insurers
KNTE,Kinnate Biopharma Inc. Common Stock,$23.35,0.32,1.389%,1015829701.00,United States,2020,18087,Health Care,Major Pharmaceuticals
KOD,Kodiak Sciences Inc Common Stock,$78.49,-2.39,-2.955%,4023789144.00,United States,2018,105903,Health Care,Major Pharmaceuticals
KOPN,Kopin Corporation Common Stock,$7.8628,-0.1872,-2.325%,717754699.00,United States,1992,1582049,Capital Goods,Industrial Machinery/Components
KOR,Corvus Gold Inc. Common Shares,$2.9675,-0.1025,-3.339%,376314521.00,Canada,,162122,Basic Industries,Precious Metals
KOSS,Koss Corporation Common Stock,$29.60,-11.12,-27.308%,252097961.00,United States,,5264959,Consumer Non-Durables,Consumer Electronics/Appliances
KPTI,Karyopharm Therapeutics Inc. Common Stock,$9.13,-0.13,-1.404%,685595137.00,United States,2013,215445,Miscellaneous,Diversified Commercial Services
KRBP,Kiromic BioPharma Inc. Common Stock,$8.33,0.00,0.00%,61241244.00,United States,2020,243,Consumer Durables,Specialty Chemicals
KRKR,36Kr Holdings Inc. American Depositary Shares,$2.5832,0.0232,0.906%,99594741.00,China,2019,49976,Miscellaneous,Business Services
KRMD,Repro Med Systems Inc. Common Stock,$4.565,-0.095,-2.039%,203097644.00,United States,,65527,Health Care,Medical/Dental Instruments
KRNL,Kernel Group Holdings Inc. Class A Ordinary Shares,$9.66,0.00,0.00%,0.00,United States,2021,498,Finance,Business Services
KRNLU,Kernel Group Holdings Inc. Units,$9.95,-0.03,-0.301%,0.00,United States,2021,10885,Finance,Business Services
KRNLW,Kernel Group Holdings Inc. Warrants,$0.62,0.00,0.00%,0.00,United States,2021,2,Finance,Business Services
KRNT,Kornit Digital Ltd. Ordinary Shares,$113.22,3.31,3.012%,5218159784.00,Israel,2015,165399,Capital Goods,Industrial Machinery/Components
KRNY,Kearny Financial Corp Common Stock,$12.935,0.025,0.194%,1045057106.00,United States,,87952,Finance,Savings Institutions
KRON,Kronos Bio Inc. Common Stock,$26.23,-1.06,-3.884%,1470712270.00,United States,2020,52836,Consumer Durables,Specialty Chemicals
KROS,Keros Therapeutics Inc. Common Stock,$47.95,-0.59,-1.215%,1117087794.00,United States,2020,14017,Consumer Durables,Specialty Chemicals
KRT,Karat Packaging Inc. Common Stock,$19.7724,0.3624,1.867%,389704118.00,United States,2021,16605,Capital Goods,Office Equipment/Supplies/Services
KRTX,Karuna Therapeutics Inc. Common Stock,$107.76,-0.49,-0.453%,3174382873.00,United States,2019,17644,Health Care,Major Pharmaceuticals
KRUS,Kura Sushi USA Inc. Class A Common Stock,$38.985,-1.055,-2.635%,328183605.00,United States,2019,8382,Consumer Services,Restaurants
KRYS,Krystal Biotech Inc. Common Stock,$62.40,-1.22,-1.918%,1385568725.00,United States,2017,17621,Health Care,Biotechnology: Biological Products (No Diagnostic Substances)
KSI,Kadem Sustainable Impact Corporation Class A common stock,$9.63,0.00,0.00%,210656250.00,United States,2021,2,,
