Symbol,Name,Last Sale,Net Change,% Change,Market Cap,Country,IPO Year,Volume,Sector,Industry
CSSE,Chicken Soup for the Soul Entertainment Inc. Class A Common Stock,$35.11,-1.37,-3.755%,444102809.00,United States,2017,17448,Consumer Services,Broadcasting
CSSEN,Chicken Soup for the Soul Entertainment Inc. 9.50% Notes due 2025,$26.42,-0.1537,-0.578%,0.00,United States,,6714,Consumer Services,Movies/Entertainment
CSSEP,Chicken Soup for the Soul Entertainment Inc. 9.75% Series A Cumulative Redeemable Perpetual Preferred Stock,$28.20,-0.4499,-1.57%,0.00,United States,,3850,Consumer Services,Broadcasting
CSTE,Caesarstone Ltd. Ordinary Shares,$15.97,-0.13,-0.807%,550027896.00,Israel,2012,24232,Capital Goods,Multi-Sector Companies
CSTL,Castle Biosciences Inc. Common Stock,$59.88,1.03,1.75%,1500377891.00,United States,2019,91356,Health Care,Medical Specialities
CSTR,CapStar Financial Holdings Inc. Common Stock,$22.30,0.24,1.088%,492710427.00,United States,2016,15221,Finance,Major Banks
CSWC,Capital Southwest Corporation Common Stock,$26.855,-0.055,-0.204%,564097976.00,United States,,56793,Finance,Finance/Investors Services
CSWI,CSW Industrials Inc. Common Stock,$118.32,1.16,0.99%,1856143698.00,United States,,46061,Basic Industries,Home Furnishings
CSX,CSX Corporation Common Stock,$100.40,0.82,0.823%,76042981686.00,United States,,1408752,Transportation,Railroads
CTAQ,Carney Technology Acquisition Corp. II Class A Common Stock,$9.75,0.04,0.412%,499321875.00,United States,2021,11059,,
CTAQU,Carney Technology Acquisition Corp. II Units,$9.98,0.028,0.281%,0.00,United States,2020,2041,,
CTAQW,Carney Technology Acquisition Corp. II Warrant,$0.80,-0.0145,-1.78%,0.00,United States,2021,3980,Finance,Business Services
CTAS,Cintas Corporation Common Stock,$351.27,-1.01,-0.287%,36902036510.00,United States,1983,118519,Miscellaneous,Business Services
CTBI,Community Trust Bancorp Inc. Common Stock,$44.22,-0.01,-0.023%,788508001.00,United States,,3869,Finance,Major Banks
CTG,Computer Task Group Inc. Common Stock,$9.76,-0.02,-0.204%,150089953.00,United States,,13452,Technology,EDP Services
CTHR,Charles & Colvard Ltd Common Stock,$2.69,-0.05,-1.825%,80304436.00,United States,1997,61636,Consumer Non-Durables,Consumer Specialties
CTIB,Yunhong CTI Ltd. Common Stock,$1.8336,-0.0364,-1.947%,10793945.00,United States,1997,23554,Miscellaneous,Diversified Commercial Services
CTIC,CTI BioPharma Corp. (DE) Common Stock,$2.365,-0.015,-0.63%,220612431.00,United States,1997,398394,Health Care,Major Pharmaceuticals
CTLP,Cantaloupe Inc. Common Stock,$12.305,-0.005,-0.041%,875024706.00,United States,,94067,Technology,EDP Services
CTMX,CytomX Therapeutics Inc. Common Stock,$6.85,0.13,1.935%,445326241.00,United States,2015,305988,Health Care,Major Pharmaceuticals
CTRE,CareTrust REIT Inc. Common Stock,$23.15,-0.63,-2.649%,2240574972.00,United States,,163675,Consumer Services,Real Estate Investment Trusts
CTRM,Castor Maritime Inc. Common Shares,$3.7783,0.6583,21.099%,339880184.00,Cyprus,,19831583,Transportation,Marine Transportation
CTRN,Citi Trends Inc. Common Stock,$84.87,1.14,1.362%,799309225.00,United States,2005,59826,,
CTSH,Cognizant Technology Solutions Corporation Class A Common Stock,$70.775,-0.515,-0.722%,37327576090.00,United States,1998,1907973,Technology,EDP Services
CTSO,Cytosorbents Corporation Common Stock,$7.92,-0.11,-1.37%,341810402.00,United States,,40302,Health Care,Medical/Dental Instruments
CTXR,Citius Pharmaceuticals Inc. Common Stock,$2.255,-0.065,-2.802%,305493750.00,United States,,2134147,Health Care,Major Pharmaceuticals
CTXRW,Citius Pharmaceuticals Inc. Warrant,$1.03,0.00,0.00%,0.00,United States,,16,,
CTXS,Citrix Systems Inc. Common Stock,$115.87,0.98,0.853%,14387235504.00,United States,1995,323004,Technology,Computer Software: Prepackaged Software
CUBA,Herzfeld Caribbean Basin Fund Inc. (The) Common Stock,$6.36,-0.04,-0.625%,39010109.00,United States,,9205,Finance,Investment Managers
CUE,Cue Biopharma Inc. Common Stock,$13.40,-0.55,-3.943%,408719685.00,United States,2018,83343,Health Care,Major Pharmaceuticals
CUEN,Cuentas Inc. Common Stock,$2.4399,0.0899,3.826%,33742843.00,United States,,62532,Technology,Computer Software: Prepackaged Software
CUENW,Cuentas Inc. Warrant,$0.6599,0.1399,26.904%,0.00,United States,,1420,Miscellaneous,Business Services
CURI,CuriosityStream Inc. Class A Common Stock,$12.17,-0.04,-0.328%,639731129.00,United States,2020,280089,Consumer Services,Broadcasting
CURIW,CuriosityStream Inc. Warrant,$3.80,0.16,4.396%,0.00,United States,2020,12588,Consumer Services,Movies/Entertainment
CUTR,Cutera Inc. Common Stock,$43.74,-0.48,-1.085%,778715205.00,United States,2004,78071,Health Care,Biotechnology: Electromedical & Electrotherapeutic Apparatus
CVAC,CureVac N.V. Ordinary Shares,$112.05,-2.56,-2.234%,20865930383.00,Germany,2020,190737,Health Care,Major Pharmaceuticals
CVBF,CVB Financial Corporation Common Stock,$22.36,0.11,0.494%,3039148214.00,United States,,41117,Finance,Major Banks
CVCO,Cavco Industries Inc. Common Stock When Issued,$219.46,-1.08,-0.49%,2013992321.00,United States,,7696,Basic Industries,Homebuilding
CVCY,Central Valley Community Bancorp Common Stock,$21.18,-0.07,-0.329%,265377119.00,United States,,6026,Finance,Major Banks
CVET,Covetrus Inc. Common Stock,$26.99,-0.16,-0.589%,3686548014.00,United States,,92357,Health Care,Managed Health Care
CVGI,Commercial Vehicle Group Inc. Common Stock,$11.60,0.11,0.957%,382056718.00,United States,2004,139482,Capital Goods,Auto Parts:O.E.M.
CVGW,Calavo Growers Inc. Common Stock,$73.54,-0.49,-0.662%,1301658000.00,United States,,38548,Consumer Non-Durables,Specialty Foods
CVLG,Covenant Logistics Group Inc. Class A Common Stock,$22.64,0.11,0.488%,379265552.00,United States,,13179,Transportation,Trucking Freight/Courier Services
CVLT,Commvault Systems Inc. Common Stock,$75.22,-0.92,-1.208%,3462093998.00,United States,2006,63386,Technology,Computer Software: Prepackaged Software
CVLY,Codorus Valley Bancorp Inc Common Stock,$19.49,0.16,0.828%,192496727.00,United States,,5759,Finance,Savings Institutions
CVV,CVD Equipment Corporation Common Stock,$4.2699,0.0699,1.664%,28541211.00,United States,,5865,Technology,Industrial Machinery/Components
CWBC,Community West Bancshares Common Stock,$12.25,0.25,2.083%,104448559.00,United States,,115,Finance,Major Banks
CWBR,CohBar Inc. Common Stock,$1.32,0.03,2.326%,81560589.00,United States,,75927,Health Care,Biotechnology: In Vitro & In Vivo Diagnostic Substances
CWCO,Consolidated Water Co. Ltd. Ordinary Shares,$12.81,0.23,1.828%,194730895.00,Cayman Islands,,39411,Public Utilities,Water Supply
CWST,Casella Waste Systems Inc. Class A Common Stock,$66.23,-0.33,-0.496%,3401793478.00,United States,1997,15477,Public Utilities,Environmental Services
CXDC,China XD Plastics Company Limited Common Stock,$0.65,0.008,1.246%,45856747.00,China,,86476,Consumer Non-Durables,Plastic Products
CXDO,Crexendo Inc. Common Stock,$5.51,-0.14,-2.478%,101632424.00,United States,,36152,Consumer Services,Telecommunications Equipment
CYAD,Celyad Oncology SA American Depositary Shares,$5.50,0.13,2.421%,82528358.00,Belgium,2015,44469,Health Care,Major Pharmaceuticals
CYAN,Cyanotech Corporation Common Stock,$3.1499,0.0299,0.958%,19205170.00,United States,,109885,Consumer Non-Durables,Farming/Seeds/Milling
CYBE,CyberOptics Corporation Common Stock,$29.50,-0.39,-1.305%,215331592.00,United States,1987,11667,Capital Goods,Electronic Components
CYBR,CyberArk Software Ltd. Ordinary Shares,$124.50,-2.66,-2.092%,4950077919.00,Israel,2014,89661,Technology,Computer Software: Prepackaged Software
CYCC,Cyclacel Pharmaceuticals Inc. Common Stock,$6.82,-0.24,-3.399%,62976630.00,United States,,33460,Health Care,Major Pharmaceuticals
CYCCP,Cyclacel Pharmaceuticals Inc. 6% Convertible Preferred Stock,$9.3801,0.0001,0.001%,0.00,United States,,100,Health Care,Major Pharmaceuticals
CYCN,Cyclerion Therapeutics Inc. Common Stock,$3.27,-0.03,-0.909%,111619704.00,United States,,105289,Health Care,Major Pharmaceuticals
CYRN,CYREN Ltd. Ordinary Shares,$0.6333,-0.0217,-3.313%,47755129.00,United States,,818092,Technology,Computer Software: Prepackaged Software
CYRX,CryoPort Inc. Common Stock,$54.45,-0.77,-1.394%,2487355279.00,United States,,49786,,
CYTH,Cyclo Therapeutics Inc. Common Stock,$7.99,-0.28,-3.386%,50805701.00,United States,,62813,Health Care,Major Pharmaceuticals
CYTHW,Cyclo Therapeutics Inc. Warrant,$3.00,-0.11,-3.537%,0.00,United States,,3038,Basic Industries,Major Chemicals
CYTK,Cytokinetics Incorporated Common Stock,$20.77,-0.17,-0.812%,1490001230.00,United States,2004,95243,Health Care,Major Pharmaceuticals
CZNC,Citizens & Northern Corp Common Stock,$24.71,0.03,0.122%,395417204.00,United States,,3216,Finance,Major Banks
CZR,Caesars Entertainment Inc. Common Stock,$108.98,-0.72,-0.656%,22743975935.00,United States,,871503,Consumer Services,Hotels/Resorts
CZWI,Citizens Community Bancorp Inc. Common Stock,$13.90,-0.02,-0.144%,151350887.00,United States,,2250,Finance,Savings Institutions
DADA,Dada Nexus Limited American Depositary Shares,$25.24,-0.56,-2.171%,5949762580.00,China,2020,409913,Consumer Services,Department/Specialty Retail Stores
DAIO,Data I/O Corporation Common Stock,$6.35,0.10,1.60%,53510580.00,United States,1981,7626,Capital Goods,Industrial Machinery/Components
DAKT,Daktronics Inc. Common Stock,$6.91,-0.01,-0.145%,310717693.00,United States,1994,39939,Capital Goods,Office Equipment/Supplies/Services
DARE,Dare Bioscience Inc. Common Stock,$1.26,-0.01,-0.787%,62181097.00,United States,2014,456216,Health Care,Major Pharmaceuticals
DAWN,Day One Biopharmaceuticals Inc. Common Stock,$19.745,-2.425,-10.938%,1193169401.00,United States,2021,159054,Health Care,Major Pharmaceuticals
DBDR,Roman DBDR Tech Acquisition Corp. Class A Common Stock,$10.055,-0.034,-0.337%,291041975.00,United States,2020,48082,,
DBDRU,Roman DBDR Tech Acquisition Corp. Unit,$10.64,0.00,0.00%,0.00,United States,2020,2001,,
DBDRW,Roman DBDR Tech Acquisition Corp. Warrant,$1.21,0.00,0.00%,0.00,United States,2020,1805,Finance,Business Services
DBGI,Digital Brands Group Inc. Common Stock,$3.00,0.05,1.695%,31478217.00,United States,2021,535645,Consumer Non-Durables,Apparel
DBGIW,Digital Brands Group Inc. Warrant,$0.4697,0.0696,17.396%,0.00,United States,2021,7953,Consumer Non-Durables,Apparel
DBTX,Decibel Therapeutics Inc. Common Stock,$7.995,-0.425,-5.048%,199090938.00,United States,2021,51094,Health Care,Major Pharmaceuticals
DBVT,DBV Technologies S.A. American Depositary Shares,$5.53,-0.12,-2.124%,607170630.00,France,2014,63001,Health Care,Major Pharmaceuticals
DBX,Dropbox Inc. Class A Common Stock,$28.05,0.19,0.682%,10964112921.00,United States,2018,3004041,Technology,Computer Software: Prepackaged Software
DCBO,Docebo Inc. Common Shares,$50.77,-1.51,-2.888%,1659890068.00,Canada,,13687,,
DCOM,Dime Community Bancshares Inc. Common Stock,$34.42,-0.02,-0.058%,1431315670.00,United States,,27487,Finance,Savings Institutions
DCOMP,Dime Community Bancshares Inc. Fixed-Rate Non-Cumulative Perpetual Preferred Stock Series A,$25.6006,-0.3994,-1.536%,0.00,United States,,1298,Finance,Savings Institutions
DCPH,Deciphera Pharmaceuticals Inc. Common Stock,$32.74,-0.30,-0.908%,1897757599.00,United States,2017,154739,Health Care,Major Pharmaceuticals
DCRB,Decarbonization Plus Acquisition Corporation Class A Common Stock,$10.13,0.03,0.297%,285824302.00,United States,2020,166667,,
DCRBU,Decarbonization Plus Acquisition Corporation Unit,$11.1799,0.2299,2.10%,0.00,United States,2020,1501,,
DCRBW,Decarbonization Plus Acquisition Corporation Warrant,$1.745,0.145,9.063%,0.00,United States,2020,29442,Finance,Business Services
DCRC,Decarbonization Plus Acquisition Corporation III Class A Common Stock,$9.68,0.00,0.00%,0.00,United States,2021,16,,
DCRCU,Decarbonization Plus Acquisition Corporation III Unit,$10.00,0.00,0.00%,0.00,United States,2021,2520,,
DCRCW,Decarbonization Plus Acquisition Corporation III Warrant,$1.04,0.04,4.00%,0.00,United States,2021,1905,Finance,Business Services
DCRN,Decarbonization Plus Acquisition Corporation II Class A Common stock,$9.82,0.01,0.102%,494068750.00,United States,2021,107538,,
DCRNU,Decarbonization Plus Acquisition Corporation II Unit,$10.23,0.01,0.098%,0.00,United States,2021,26475,,
DCRNW,Decarbonization Plus Acquisition Corporation II Warrant,$1.26,-0.01,-0.787%,0.00,United States,2021,72364,Finance,Business Services
DCT,Duck Creek Technologies Inc. Common Stock,$39.10,-0.38,-0.963%,5145127632.00,United States,2020,108943,Technology,Retail: Computer Software & Peripheral Equipment
DCTH,Delcath Systems Inc. Common Stock,$11.20,0.09,0.81%,72490858.00,United States,,5673,Health Care,Medical Specialities
DDMX,DD3 Acquisition Corp. II Class A Common Stock,$9.9404,-0.0196,-0.197%,71801497.00,Mexico,2021,950,,
DDMXU,DD3 Acquisition Corp. II Unit,$10.43,0.00,0.00%,0.00,Mexico,2020,391,,
DDMXW,DD3 Acquisition Corp. II Warrant,$1.08,-0.1308,-10.803%,0.00,Mexico,2021,2170,,
DDOG,Datadog Inc. Class A Common Stock,$88.90,-2.70,-2.948%,27415288616.00,United States,2019,847234,Technology,EDP Services
DENN,Denny's Corporation Common Stock,$16.655,-0.345,-2.029%,1068332393.00,United States,,179060,Consumer Services,Restaurants
DFFN,Diffusion Pharmaceuticals Inc. Common Stock,$0.7191,-0.0059,-0.814%,73279151.00,United States,,441201,Health Care,Major Pharmaceuticals
DFH,Dream Finders Homes Inc. Class A Common Stock,$33.80,0.66,1.992%,3127226092.00,United States,2021,41290,,
DFHT,Deerfield Healthcare Technology Acquisitions Corp. Class A Common Stock,$14.80,-0.05,-0.337%,265937500.00,United States,2020,9659,,
DFHTU,Deerfield Healthcare Technology Acquisitions Corp. Unit,$15.18,-0.41,-2.63%,0.00,United States,2020,150,Health Care,Hospital/Nursing Management
DFHTW,Deerfield Healthcare Technology Acquisitions Corp. Warrant,$4.91,-0.19,-3.725%,0.00,United States,2020,4190,Health Care,Hospital/Nursing Management
DFPH,DFP Healthcare Acquisitions Corp. Class A Common Stock,$10.00,0.00,0.00%,287500000.00,United States,2020,55,Finance,Major Banks
DFPHW,DFP Healthcare Acquisitions Corp. Warrant,$1.29,0.0836,6.93%,0.00,United States,2020,1901,Finance,Major Banks
DGICA,Donegal Group Inc. Class A Common Stock,$15.50,0.18,1.175%,478390295.00,United States,,4296,Finance,Property-Casualty Insurers
DGICB,Donegal Group Inc. Class B Common Stock,$13.9095,0.00,0.00%,429301278.00,United States,1986,3,Finance,Property-Casualty Insurers
DGII,Digi International Inc. Common Stock,$18.82,-0.13,-0.686%,640435491.00,United States,1989,29119,Technology,Computer peripheral equipment
DGLY,Digital Ally Inc. Common Stock,$1.735,-0.005,-0.287%,89376254.00,United States,,490399,Miscellaneous,Diversified Manufacture
DGNS,Dragoneer Growth Opportunities Corp. II Class A Ordinary Shares,$10.0501,0.0001,0.001%,354286125.00,United States,2020,1436,Finance,Business Services
DGNU,Dragoneer Growth Opportunities Corp. III Class A Ordinary Shares,$10.01,0.00,0.00%,500500000.00,United States,2021,20,Finance,Business Services
DHBC,DHB Capital Corp. Class A common stock,$9.69,-0.01,-0.103%,348234375.00,United States,2021,2031,,
DHBCU,DHB Capital Corp. Unit,$9.99,-0.04,-0.399%,359015625.00,United States,2021,4975,,
DHBCW,DHB Capital Corp. Warrant,$0.6202,0.00,0.00%,0.00,United States,2021,66,,
DHC,Diversified Healthcare Trust Common Shares of Beneficial Interest,$3.67,-0.17,-4.427%,874445314.00,United States,,334713,Consumer Services,Real Estate Investment Trusts
DHCA,DHC Acquisition Corp. Class A ordinary share,$9.72,0.01,0.103%,375435000.00,United States,2021,208,Finance,Business Services
DHCAU,DHC Acquisition Corp. Unit,$9.93,0.01,0.101%,0.00,United States,2021,300,Finance,Business Services
DHCAW,DHC Acquisition Corp. Warrant,$0.6799,-0.0256,-3.629%,0.00,United States,2021,2700,Finance,Business Services
DHCNI,Diversified Healthcare Trust 5.625% Senior Notes due 2042,$23.28,-0.05,-0.214%,0.00,United States,,2815,Consumer Services,Real Estate Investment Trusts
DHCNL,Diversified Healthcare Trust 6.25% Senior Notes Due 2046,$24.9101,-0.0899,-0.36%,0.00,United States,,4707,,
DHHC,DiamondHead Holdings Corp. Class A Common Stock,$9.76,-0.02,-0.204%,336720000.00,United States,2021,1001,,
DHHCU,DiamondHead Holdings Corp. Unit,$10.00,0.035,0.351%,0.00,United States,2021,1223,,
DHIL,Diamond Hill Investment Group Inc. Class A Common Stock,$175.95,-0.20,-0.114%,561971984.00,United States,,2046,Finance,Investment Managers
DIOD,Diodes Incorporated Common Stock,$74.20,-0.92,-1.225%,3310560253.00,United States,,30915,Technology,Semiconductors
DISA,Disruptive Acquisition Corporation I Class A Ordinary Shares,$9.725,0.00,0.00%,334296875.00,United States,2021,3,Finance,Business Services
DISAU,Disruptive Acquisition Corporation I Unit,$9.97,0.00,0.00%,0.00,United States,2021,10,Finance,Business Services
DISAW,Disruptive Acquisition Corporation I Warrant,$0.71,-0.01,-1.389%,0.00,United States,2021,1939,Finance,Business Services
DISCA,Discovery Inc. Series A Common Stock,$31.38,-0.77,-2.395%,15859684432.00,United States,,3167611,Consumer Services,Television Services
DISCB,Discovery Inc. Series B Common Stock,$68.9597,-0.7003,-1.005%,34852743164.00,United States,,497,Consumer Services,Television Services
DISCK,Discovery Inc. Series C Common Stock,$29.38,-0.73,-2.424%,14848869618.00,United States,,842268,Consumer Services,Television Services
DISH,DISH Network Corporation Class A Common Stock,$44.71,-0.77,-1.693%,23593030541.00,United States,1995,735930,Consumer Services,Television Services
DJCO,Daily Journal Corp. (S.C.) Common Stock,$349.80,0.00,0.00%,482984951.00,United States,,631,Consumer Services,Newspapers/Magazines
DKDCU,Data Knights Acquisition Corp. Unit,$10.10,0.00,0.00%,0.00,United Kingdom,2021,30504,Finance,Business Services
DKNG,DraftKings Inc. Class A Common Stock,$49.91,-1.06,-2.08%,20046048347.00,United States,2019,3948132,Consumer Services,Services-Misc. Amusement & Recreation
DLCA,Deep Lake Capital Acquisition Corp. Class A Ordinary Shares,$9.70,0.02,0.207%,250987500.00,United States,2021,1225,Finance,Business Services
DLCAU,Deep Lake Capital Acquisition Corp. Unit,$10.00,0.04,0.402%,0.00,United States,2021,1856,Finance,Business Services
DLCAW,Deep Lake Capital Acquisition Corp. Warrant,$0.7299,0.0191,2.687%,0.00,United States,2021,3450,Finance,Business Services
DLHC,DLH Holdings Corp.,$11.735,-0.2319,-1.938%,147214472.00,United States,,9292,Miscellaneous,Business Services
DLPN,Dolphin Entertainment Inc. Common Stock,$8.73,-0.38,-4.171%,66350671.00,United States,,197518,,
DLTH,Duluth Holdings Inc. Class B Common Stock,$16.09,-1.03,-6.016%,529557475.00,United States,2015,271084,Consumer Services,Department/Specialty Retail Stores
DLTR,Dollar Tree Inc. Common Stock,$100.16,2.15,2.194%,23232499820.00,United States,1995,1593155,Consumer Services,Department/Specialty Retail Stores
DMAC,DiaMedica Therapeutics Inc. Common Stock,$7.57,-0.04,-0.526%,141854790.00,United States,2018,24382,,
DMLP,Dorchester Minerals L.P. Common Units Representing Limited Partnership Interests,$15.8899,0.0799,0.505%,551058141.00,United States,,19078,Energy,Oil & Gas Production
DMRC,Digimarc Corporation Common Stock,$33.00,-0.98,-2.884%,558189423.00,United States,,15469,Technology,EDP Services
DMTK,DermTech Inc. Common Stock,$39.97,-0.03,-0.075%,1156679359.00,United States,2017,441839,Health Care,Managed Health Care
DNLI,Denali Therapeutics Inc. Common Stock,$62.82,-0.94,-1.474%,7613294632.00,United States,2017,124655,Health Care,Biotechnology: Biological Products (No Diagnostic Substances)
DOCU,DocuSign Inc. Common Stock,$194.52,-6.01,-2.997%,37845055684.00,United States,2018,909010,Technology,EDP Services
DOGZ,Dogness (International) Corporation Class A Common Stock,$1.65,-0.04,-2.367%,48468443.00,China,2017,31486,Consumer Durables,Miscellaneous manufacturing industries
DOMO,Domo Inc. Class B Common Stock,$65.70,-0.75,-1.129%,2080641211.00,United States,2018,109796,Technology,Computer Software: Prepackaged Software
DOOO,BRP Inc. (Recreational Products) Common Subordinate Voting Shares,$76.935,-5.235,-6.371%,6454976289.00,Canada,,119201,,
DORM,Dorman Products Inc. Common Stock,$103.28,1.28,1.255%,3313488759.00,United States,,14987,Capital Goods,Auto Parts:O.E.M.
DOX,Amdocs Limited Ordinary Shares,$79.41,0.65,0.825%,10137004140.00,Guernsey,,208135,Technology,EDP Services
DOYU,DouYu International Holdings Limited ADS,$7.3663,-0.2337,-3.075%,2389699836.00,China,2019,1507404,Technology,Computer Software: Programming Data Processing
DRIO,DarioHealth Corp. Common Stock,$17.84,0.12,0.677%,277290973.00,Israel,,114750,Health Care,Medical/Dental Instruments
DRNA,Dicerna Pharmaceuticals Inc. Common Stock,$29.84,-0.28,-0.93%,2294699223.00,United States,2014,94876,Health Care,Biotechnology: Commercial Physical & Biological Resarch
DRRX,DURECT Corporation Common Stock,$1.65,-0.03,-1.786%,375220200.00,United States,2000,162482,Health Care,Major Pharmaceuticals
DRTT,DIRTT Environmental Solutions Ltd. Common Shares,$3.5202,-0.0998,-2.757%,298143033.00,Canada,,7568,,
DRVN,Driven Brands Holdings Inc. Common Stock,$29.51,-0.02,-0.068%,4940323398.00,United States,2021,70160,,
DSAC,Duddell Street Acquisition Corp. Class A Ordinary Shares,$9.68,0.02,0.207%,211750000.00,Hong Kong,2020,5446,Finance,Business Services
DSACU,Duddell Street Acquisition Corp. Unit,$10.21,-0.04,-0.39%,0.00,Hong Kong,2020,100,Finance,Business Services
DSACW,Duddell Street Acquisition Corp. Warrant,$1.1601,0.0099,0.861%,0.00,Hong Kong,2020,150,Finance,Business Services
DSEY,Diversey Holdings Ltd. Ordinary Shares,$16.53,-0.44,-2.593%,4979581933.00,United States,2021,44981,Consumer Durables,Specialty Chemicals
DSGN,Design Therapeutics Inc. Common Stock,$26.425,0.175,0.667%,1469687734.00,United States,2021,39524,Health Care,Major Pharmaceuticals
DSGX,Descartes Systems Group Inc. (The) Common Stock,$61.07,2.53,4.322%,5161297767.00,Canada,,94543,,
DSKE,Daseke Inc. Common Stock,$7.47,-0.03,-0.40%,486996707.00,United States,2015,109133,,
DSKEW,Daseke Inc. Warrant,$0.1497,0.0096,6.852%,0.00,United States,2015,34540,,
DSP,Viant Technology Inc. Class A Common Stock,$33.305,-1.095,-3.183%,1962848792.00,United States,2021,194179,Technology,EDP Services
DSPG,DSP Group Inc. Common Stock,$15.75,0.01,0.064%,381571817.00,United States,1994,29775,Technology,Semiconductors
DSWL,Deswell Industries Inc. Common Shares,$3.9592,-0.0108,-0.272%,63011614.00,Macau,1995,4144,Consumer Non-Durables,Plastic Products
DTEA,DAVIDsTEA Inc. Common Stock,$4.25,-0.05,-1.163%,111587018.00,Canada,2015,32414,,
DTIL,Precision BioSciences Inc. Common Stock,$10.99,-0.31,-2.743%,631708783.00,United States,2019,174071,Health Care,Major Pharmaceuticals
DTOC,Digital Transformation Opportunities Corp. Class A Common Stock,$9.93,0.00,0.00%,413956875.00,United States,2021,56,,
DTOCU,Digital Transformation Opportunities Corp. Units,$10.00,0.02,0.20%,0.00,United States,2021,2300,,
DTOCW,Digital Transformation Opportunities Corp. Warrant,$0.69,0.00,0.00%,0.00,United States,2021,252,Finance,Business Services
DTSS,Datasea Inc. Common Stock,$2.56,0.03,1.186%,54973793.00,China,,22417,Technology,Retail: Computer Software & Peripheral Equipment
DTST,Data Storage Corporation Common Stock,$5.60,-0.15,-2.609%,26964353.00,United States,,21257,Technology,EDP Services
DTSTW,Data Storage Corporation Warrant,$0.80,0.0199,2.551%,0.00,United States,,10000,,
DUNE,Dune Acquisition Corporation Class A Common Stock,$9.77,0.03,0.308%,,United States,2021,3404,,
DUNEU,Dune Acquisition Corporation Unit,$10.10,0.06,0.598%,0.00,United States,2020,3572,,
DUNEW,Dune Acquisition Corporation Warrant,$0.66,-0.0299,-4.334%,0.00,United States,2021,3183,Finance,Business Services
DUO,Fangdd Network Group Ltd. American Depositary Shares,$3.23,-0.06,-1.824%,257905044.00,China,2019,182318,Technology,Computer Software: Programming Data Processing
DUOT,Duos Technologies Group Inc. Common Stock,$10.00,0.195,1.989%,35388210.00,United States,,2382,Technology,Computer Software: Prepackaged Software
DVAX,Dynavax Technologies Corporation Common Stock,$8.50,0.08,0.95%,973999802.00,United States,2004,496542,Health Care,Major Pharmaceuticals
DWSN,Dawson Geophysical Company Common Stock,$2.43,-0.03,-1.22%,57051715.00,United States,,3780,Energy,Oil & Gas Production
DXCM,DexCom Inc. Common Stock,$374.795,3.805,1.026%,36244877671.00,United States,2005,212485,Health Care,Medical/Dental Instruments
DXPE,DXP Enterprises Inc. Common Stock,$30.58,-0.21,-0.682%,587347705.00,United States,,9708,Capital Goods,Industrial Machinery/Components
DXYN,Dixie Group Inc. (The) Common Stock,$2.73,-0.05,-1.799%,43026416.00,United States,,10014,Consumer Durables,Home Furnishings
DYAI,Dyadic International Inc. Common Stock,$3.60,-0.07,-1.907%,99194965.00,United States,,41460,Health Care,Biotechnology: Biological Products (No Diagnostic Substances)
DYN,Dyne Therapeutics Inc. Common Stock,$17.88,-1.17,-6.142%,919870626.00,United States,2020,52655,Consumer Durables,Specialty Chemicals
DYNS,Dynamics Special Purpose Corp. Class A Common Stock,$9.98,-0.01,-0.10%,293466890.00,United States,2021,3184,Finance,Business Services
DYNT,Dynatronics Corporation Common Stock,$1.2344,-0.0156,-1.248%,21434929.00,United States,,68021,Health Care,Medical/Dental Instruments
DZSI,DZS Inc. Common Stock,$17.94,-0.24,-1.32%,482903287.00,United States,,63697,Public Utilities,Telecommunications Equipment
EA,Electronic Arts Inc. Common Stock,$141.59,0.19,0.134%,40521808610.00,United States,,496096,Technology,Computer Software: Prepackaged Software
EAC,Edify Acquisition Corp. Class A Common Stock,$9.665,-0.015,-0.155%,333442500.00,United States,2021,218,,
EACPU,Edify Acquisition Corp. Units,$9.97,-0.03,-0.30%,0.00,United States,2021,402,,
EACPW,Edify Acquisition Corp. Warrant,$0.60,0.02,3.448%,0.00,United States,2021,500,Finance,Business Services
