Symbol,Name,Last Sale,Net Change,% Change,Market Cap,Country,IPO Year,Volume,Sector,Industry
QLYS,Qualys Inc. Common Stock,$98.47,-0.29,-0.294%,3854301613.00,United States,2012,85930,Technology,EDP Services
QMCO,Quantum Corporation Common Stock,$7.13,-0.32,-4.295%,407030032.00,United States,,261061,Technology,Electronic Components
QNST,QuinStreet Inc. Common Stock,$17.79,-0.21,-1.167%,953890389.00,United States,2010,59445,Technology,Advertising
QQQX,Nuveen NASDAQ 100 Dynamic Overwrite Fund Shares of Beneficial Interest,$28.43,-0.14,-0.49%,1195934959.00,United States,,42069,Finance,Finance Companies
QRHC,Quest Resource Holding Corporation Common Stock,$5.055,-0.065,-1.27%,94632057.00,United States,,24387,Capital Goods,Building Products
QRTEA,Qurate Retail Inc. Series A Common Stock ,$13.51,-0.59,-4.184%,5524466211.00,United States,,1777756,Consumer Services,Catalog/Specialty Distribution
QRTEB,Qurate Retail Inc. Series B Common Stock ,$14.00,-0.11,-0.78%,5724835452.00,United States,,578,Consumer Services,Catalog/Specialty Distribution
QRTEP,Qurate Retail Inc. 8.0% Fixed Rate Cumulative Redeemable Preferred Stock,$107.70,-0.18,-0.167%,0.00,United States,,2353,Consumer Services,Catalog/Specialty Distribution
QRVO,Qorvo Inc. Common Stock,$182.59,-2.72,-1.468%,20557226003.00,United States,,254378,Capital Goods,Industrial Machinery/Components
QTNT,Quotient Limited Ordinary Shares,$4.31,-0.11,-2.489%,435884320.00,Switzerland,2014,114790,Health Care,Biotechnology: In Vitro & In Vivo Diagnostic Substances
QTRX,Quanterix Corporation Common Stock,$52.34,1.30,2.547%,1901857539.00,United States,2017,136506,Health Care,Industrial Specialties
QTT,Qutoutiao Inc. American Depositary Shares,$1.935,-0.125,-6.068%,556296540.00,China,2018,1606706,Technology,Computer Software: Prepackaged Software
QUIK,QuickLogic Corporation Common Stock,$6.10,-0.04,-0.651%,69846739.00,United States,1999,44282,Technology,Semiconductors
QUMU,Qumu Corporation Common Stock,$4.7985,0.0185,0.387%,84414123.00,United States,,13427,Technology,Retail: Computer Software & Peripheral Equipment
QURE,uniQure N.V. Ordinary Shares,$34.49,0.80,2.375%,1583943903.00,Netherlands,2014,83394,Health Care,Major Pharmaceuticals
RAAC,Revolution Acceleration Acquisition Corp Class A Common Stock,$9.9214,0.0014,0.014%,380320330.00,United States,2021,172084,,
RAACU,Revolution Acceleration Acquisition Corp Unit,$10.36,0.00,0.00%,0.00,United States,2020,1,,
RAACW,Revolution Acceleration Acquisition Corp Warrant,$1.48,0.02,1.37%,0.00,United States,2021,1765,Finance,Business Services
RACA,Therapeutics Acquisition Corp. Class A Common Stock,$10.205,-0.045,-0.439%,177912950.00,United States,2020,1495,,
RACB,Research Alliance Corp. II Class A Common Stock,$10.29,0.00,0.00%,197429085.00,United States,2021,2,,
RADA,RADA Electronic Industries Ltd. Ordinary Shares,$10.90,-0.45,-3.965%,473987209.00,Israel,,263247,,
RADI,Radius Global Infrastructure Inc. Class A Common Stock,$14.80,-0.42,-2.76%,905977678.00,United States,,108249,Consumer Services,Telecommunications Equipment
RAIL,FreightCar America Inc. Common Stock,$6.87,-0.24,-3.376%,106772990.00,United States,2005,725792,Capital Goods,Railroads
RAIN,Rain Therapeutics Inc. Common Stock,$19.13,-0.49,-2.497%,506613286.00,United States,2021,21629,Health Care,Major Pharmaceuticals
RAMMU,Aries I Acquisition Corporation Unit,$10.08,-0.01,-0.099%,0.00,Cayman Islands,2021,23433,Finance,Business Services
RAND,Rand Capital Corporation Common Stock,$18.36,0.00,0.00%,47408623.00,United States,,124,Finance,Finance/Investors Services
RAPT,RAPT Therapeutics Inc. Common Stock,$17.6506,-0.7494,-4.073%,441423979.00,United States,2019,51321,Health Care,Major Pharmaceuticals
RARE,Ultragenyx Pharmaceutical Inc. Common Stock,$95.67,-2.03,-2.078%,6456073066.00,United States,2014,87543,Health Care,Major Pharmaceuticals
RAVE,Rave Restaurant Group Inc. Common Stock,$1.6319,0.0019,0.117%,29382203.00,United States,,176171,Consumer Services,Restaurants
RAVN,Raven Industries Inc. Common Stock,$44.67,-0.24,-0.534%,1604440845.00,United States,,27008,Capital Goods,Office Equipment/Supplies/Services
RBB,RBB Bancorp Common Stock,$24.51,-0.13,-0.528%,479715210.00,United States,2017,10930,Finance,Commercial Banks
RBBN,Ribbon Communications Inc. Common Stock,$7.44,-0.14,-1.847%,1096413969.00,United States,,61825,Technology,EDP Services
RBCAA,Republic Bancorp Inc. Class A Common Stock,$46.45,0.33,0.716%,965750172.00,United States,1998,5580,Finance,Major Banks
RBCN,Rubicon Technology Inc. Common Stock,$9.66,0.01,0.104%,23584359.00,United States,2007,1133,Technology,Semiconductors
RBKB,Rhinebeck Bancorp Inc. Common Stock,$10.69,0.12,1.135%,119014870.00,United States,2019,1844,Finance,Major Banks
RBNC,Reliant Bancorp Inc. Common Stock,$29.80,-0.11,-0.368%,488920256.00,United States,,3032,Finance,Major Banks
RCAT,Red Cat Holdings Inc. Common Stock,$2.51,0.04,1.619%,85011316.00,United States,,106023,Technology,Retail: Computer Software & Peripheral Equipment
RCEL,Avita Therapeutics Inc. Common Stock,$17.20,-0.13,-0.75%,427297588.00,Australia,,31186,Health Care,Medical Specialities
RCHG,Recharge Acquisition Corp. Class A Common Stock,$9.80,0.00,0.00%,245490000.00,United States,2020,5428,,
RCHGU,Recharge Acquisition Corp. Unit,$10.10,0.00,0.00%,0.00,United States,2020,15201,,
RCHGW,Recharge Acquisition Corp. Warrant,$0.6311,-0.009,-1.406%,0.00,United States,2020,7688,Finance,Business Services
RCII,Rent-A-Center Inc. Common Stock,$60.75,-0.34,-0.557%,4028292891.00,United States,1995,172270,Technology,Diversified Commercial Services
RCKT,Rocket Pharmaceuticals Inc. Common Stock,$42.46,0.82,1.969%,2691834667.00,United States,2015,82489,Health Care,Major Pharmaceuticals
RCKY,Rocky Brands Inc. Common Stock,$54.84,0.00,0.00%,399423521.00,United States,1993,33024,Consumer Non-Durables,Shoe Manufacturing
RCLF,Rosecliff Acquisition Corp I Class A Common Stock,$9.63,-0.01,-0.104%,304548750.00,United States,2021,1400,,
RCLFU,Rosecliff Acquisition Corp I Unit,$9.90,0.01,0.101%,0.00,United States,2021,30932,,
RCLFW,Rosecliff Acquisition Corp I Warrants,$0.65,0.00,0.00%,0.00,United States,2021,25000,Finance,Business Services
RCM,R1 RCM Inc. Common Stock,$21.56,-0.54,-2.443%,5647306354.00,United States,,738871,Consumer Services,Other Consumer Services
RCMT,RCM Technologies Inc. Common Stock,$3.881,-0.089,-2.242%,43036735.00,United States,,33252,Consumer Services,Military/Government/Technical
RCON,Recon Technology Ltd. Class A Ordinary Shares,$12.92,1.00,8.389%,93060589.00,China,2009,542053,Energy,Oilfield Services/Equipment
RDCM,Radcom Ltd. Ordinary Shares,$10.025,-0.035,-0.348%,139785151.00,Israel,1997,6676,Technology,Computer peripheral equipment
RDFN,Redfin Corporation Common Stock,$59.22,0.51,0.869%,6161338281.00,United States,2017,404567,Finance,Real Estate
RDHL,Redhill Biopharma Ltd. American Depositary Shares,$6.88,-0.34,-4.709%,321071285.00,Israel,,238138,Health Care,Major Pharmaceuticals
RDI,Reading International Inc Class A Common Stock,$6.84,-0.11,-1.583%,149176317.00,United States,,17982,Consumer Services,Movies/Entertainment
RDIB,Reading International Inc Class B Common Stock,$22.8472,0.00,0.00%,498283792.00,United States,,45,Consumer Services,Movies/Entertainment
RDNT,RadNet Inc. Common Stock,$26.165,-0.165,-0.627%,1378896520.00,United States,,41613,Health Care,Medical Specialities
RDUS,Radius Health Inc. Common Stock,$17.68,-0.41,-2.266%,835250211.00,United States,2014,51720,Health Care,Major Pharmaceuticals
RDVT,Red Violet Inc. Common Stock ,$21.94,0.09,0.412%,268584039.00,United States,,9197,Technology,Computer Software: Prepackaged Software
RDWR,Radware Ltd. Ordinary Shares,$28.65,0.11,0.385%,1304576031.00,Israel,1999,87620,Technology,EDP Services
REAL,The RealReal Inc. Common Stock,$17.87,-0.22,-1.216%,1622768892.00,United States,2019,1181277,Consumer Services,Catalog/Specialty Distribution
REDU,RISE Education Cayman Ltd American Depositary Shares,$3.39,0.01,0.296%,191477051.00,China,2017,33637,Miscellaneous,Service to the Health Industry
REED,Reeds Inc. Common Stock,$1.03,0.00,0.00%,96391911.00,United States,,2309502,Consumer Non-Durables,Beverages (Production/Distribution)
REFR,Research Frontiers Incorporated Common Stock,$2.40,0.00,0.00%,75960950.00,United States,,15160,Capital Goods,Industrial Machinery/Components
REG,Regency Centers Corporation Common Stock,$66.70,-0.74,-1.097%,11329806072.00,United States,1993,264315,Consumer Services,Real Estate Investment Trusts
REGI,Renewable Energy Group Inc. Common Stock,$69.41,1.20,1.759%,3308253570.00,United States,2012,555951,Basic Industries,Major Chemicals
REGN,Regeneron Pharmaceuticals Inc. Common Stock,$500.89,-4.47,-0.885%,53366726486.00,United States,1991,163415,Health Care,Major Pharmaceuticals
REKR,Rekor Systems Inc. Common Stock,$10.74,-0.10,-0.923%,440281037.00,United States,,155342,Technology,EDP Services
RELI,Reliance Global Group Inc. Common Stock,$3.885,-0.065,-1.646%,42461162.00,United States,,24505,Finance,Specialty Insurers
RELIW,Reliance Global Group Inc. Series A Warrants,$0.4501,0.00,0.00%,0.00,United States,,26,Consumer Services,Broadcasting
RELL,Richardson Electronics Ltd. Common Stock,$8.56,-0.06,-0.696%,113057518.00,United States,1983,32691,Technology,Electronic Components
REPH,Recro Pharma Inc. Common Stock,$2.28,-0.01,-0.437%,105699612.00,United States,2014,104628,Health Care,Major Pharmaceuticals
REPL,Replimune Group Inc. Common Stock,$31.28,-4.97,-13.71%,1457928206.00,United States,2018,477701,Health Care,Major Pharmaceuticals
RESN,Resonant Inc. Common Stock,$3.22,-0.08,-2.424%,194562456.00,United States,2014,366265,Technology,Semiconductors
RETA,Reata Pharmaceuticals Inc. Class A Common Stock,$137.77,1.82,1.339%,4997994159.00,United States,2016,100516,Health Care,Major Pharmaceuticals
RETO,ReTo Eco-Solutions Inc. Common Shares,$1.08,-0.03,-2.703%,27145800.00,China,2017,253102,Capital Goods,Multi-Sector Companies
REVH,Revolution Healthcare Acquisition Corp. SAIL Class A Common Stock,$9.82,0.02,0.204%,567105000.00,United States,2021,7880,,
REVHU,Revolution Healthcare Acquisition Corp. SAIL Units,$10.05,0.04,0.40%,0.00,United States,2021,1974,,
REVHW,Revolution Healthcare Acquisition Corp. SAIL Warrant.,$1.05,-0.05,-4.545%,0.00,United States,2021,77630,,
REYN,Reynolds Consumer Products Inc. Common Stock,$30.24,0.12,0.398%,6343100124.00,United States,2020,87415,Capital Goods,Office Equipment/Supplies/Services
RFIL,RF Industries Ltd. Common Stock,$7.70,0.09,1.183%,76787911.00,United States,,9196,Capital Goods,Electrical Products
RGCO,RGC Resources Inc. Common Stock,$23.185,-0.035,-0.151%,190784009.00,United States,,2530,Public Utilities,Oil & Gas Production
RGEN,Repligen Corporation Common Stock,$173.39,-5.05,-2.83%,9519885360.00,United States,1986,73976,Health Care,Medical/Dental Instruments
RGLD,Royal Gold Inc. Common Stock,$119.71,-4.24,-3.421%,7853753636.00,United States,,130888,,
RGLS,Regulus Therapeutics Inc. Common Stock,$1.06,0.04,3.922%,79419080.00,United States,2012,914313,Health Care,Major Pharmaceuticals
RGNX,REGENXBIO Inc. Common Stock,$34.425,-0.605,-1.727%,1463384925.00,United States,2015,50076,Health Care,Biotechnology: Biological Products (No Diagnostic Substances)
RGP,Resources Connection Inc. Common Stock,$14.57,-0.06,-0.41%,478231431.00,United States,,10574,Miscellaneous,Business Services
RIBT,RiceBran Technologies Common Stock,$1.04,-0.02,-1.887%,47270045.00,United States,,156834,Consumer Non-Durables,Specialty Foods
RICK,RCI Hospitality Holdings Inc. Common Stock,$76.20,-2.18,-2.781%,685793142.00,United States,1995,26730,Consumer Services,Restaurants
RIDE,Lordstown Motors Corp. Class A Common Stock,$12.90,0.53,4.285%,2277873950.00,United States,2019,15098613,Capital Goods,Construction/Ag Equipment/Trucks
RIGL,Rigel Pharmaceuticals Inc. Common Stock,$3.74,-0.03,-0.796%,636414605.00,United States,2000,391976,Health Care,Major Pharmaceuticals
RILY,B. Riley Financial Inc. Common Stock,$69.90,-1.24,-1.743%,1900924139.00,United States,,93424,Finance,Investment Managers
RILYG,B. Riley Financial Inc. 7.25% Senior Notes due 2027,$25.35,-0.0005,-0.002%,0.00,United States,,4086,Miscellaneous,Business Services
RILYH,B. Riley Financial Inc. 7.375% Senior Notes due 2023,$25.745,0.055,0.214%,0.00,United States,,1395,Miscellaneous,Business Services
RILYI,B. Riley Financial Inc. 6.875% Senior Notes due 2023,$25.84,0.00,0.00%,0.00,United States,,219,Miscellaneous,Business Services
RILYK,B. Riley Financial Inc. 5.50% Senior Notes Due 2026,$25.16,0.00,0.00%,0.00,United States,,14658,Miscellaneous,Business Services
RILYL,B. Riley Financial Inc. Depositary Shares each representing 1/1000th in a share of 7.375% Series B Cumulative Perpetual Preferred Stock par value $0.0001,$27.46,0.00,0.00%,0.00,United States,,628,Finance,Investment Managers
RILYM,B. Riley Financial Inc. 6.375% Senior Notes due 2025,$25.65,-0.01,-0.039%,0.00,United States,,1987,Miscellaneous,Business Services
RILYN,B. Riley Financial Inc. 6.50% Senior Notes Due 2026,$26.00,0.00,0.00%,0.00,United States,,8432,Miscellaneous,Business Services
RILYO,B. Riley Financial Inc. 6.75% Senior Notes due 2024,$25.88,0.03,0.116%,0.00,United States,,1562,Miscellaneous,Business Services
RILYP,B. Riley Financial Inc. Depositary Shares each representing a 1/1000th fractional interest in a share of Series A Cumulative Perpetual Preferred Stock,$26.78,0.03,0.112%,0.00,United States,,246,Finance,Investment Managers
RILYT,B. Riley Financial Inc. 6.00% Senior Notes Due 2028,$25.765,0.0849,0.331%,0.00,United States,,3705,Miscellaneous,Business Services
RIOT,Riot Blockchain Inc.  Common Stock ,$28.564,-1.466,-4.882%,2740565325.00,United States,,6344023,Technology,Retail: Computer Software & Peripheral Equipment
RIVE,Riverview Financial Corporation Common Stock,$10.3145,-0.0055,-0.053%,96450487.00,United States,,1010,Finance,Major Banks
RKDA,Arcadia Biosciences Inc. Common Stock,$2.7892,-0.1008,-3.488%,59511066.00,United States,2015,276129,Basic Industries,Agricultural Chemicals
RLAY,Relay Therapeutics Inc. Common Stock,$32.94,-0.05,-0.152%,3043074938.00,United States,2020,195569,Health Care,Major Pharmaceuticals
RLMD,Relmada Therapeutics Inc. Common Stock,$29.34,-0.21,-0.711%,492801594.00,United States,,39749,Health Care,Major Pharmaceuticals
RMBI,Richmond Mutual Bancorporation Inc. Common Stock,$14.45,-0.12,-0.824%,186170953.00,United States,2019,8202,,
RMBL,RumbleOn Inc. Class B Common Stock,$39.00,-0.42,-1.065%,132329418.00,United States,,7483,Capital Goods,Automotive Aftermarket
RMBS,Rambus Inc. Common Stock,$19.33,-0.17,-0.872%,2174726560.00,United States,1997,94276,Technology,Semiconductors
RMCF,Rocky Mountain Chocolate Factory Inc. Common Stock,$6.59,-0.03,-0.453%,40029591.00,United States,,33117,Consumer Non-Durables,Specialty Foods
RMGB,RMG Acquisition Corp. II Class A Ordinary Shares,$9.95,0.05,0.505%,429093750.00,United States,2021,18763,Finance,Business Services
RMGBU,RMG Acquisition Corp. II Unit,$10.455,0.00,0.00%,0.00,United States,2020,20,Finance,Business Services
RMGBW,RMG Acquisition Corp. II Warrant,$1.60,-0.01,-0.621%,0.00,United States,2021,6811,Finance,Business Services
RMGC,RMG Acquisition Corp. III Class A Ordinary Shares,$9.73,-0.04,-0.409%,587448750.00,United States,2021,163,Finance,Business Services
RMGCU,RMG Acquisition Corp. III Unit,$9.99,0.04,0.402%,0.00,United States,2021,1551,Finance,Business Services
RMGCW,RMG Acquisition Corp. III Warrant,$0.92,0.02,2.222%,0.00,United States,2021,5900,Finance,Business Services
RMNI,Rimini Street Inc. (DE) Common Stock,$6.36,-0.17,-2.603%,542291760.00,United States,2015,96824,Technology,EDP Services
RMR,The RMR Group Inc. Class A Common Stock,$39.60,0.09,0.228%,649962364.00,United States,,15771,Finance,Real Estate
RMRM,RMR Mortgage Trust Common Stock,$11.98,-0.09,-0.746%,122220068.00,United States,,8918,Consumer Services,Real Estate Investment Trusts
RMTI,Rockwell Medical Inc. (DE) Common Stock,$0.9017,-0.0164,-1.786%,84425027.00,United States,1998,365499,Health Care,Major Pharmaceuticals
RNA,Avidity Biosciences Inc. Common Stock,$21.94,-0.07,-0.318%,825278826.00,United States,2020,24342,Health Care,Major Pharmaceuticals
RNDB,Randolph Bancorp Inc. Common Stock,$22.00,0.00,0.00%,116729382.00,United States,2016,2290,Finance,Major Banks
RNLX,Renalytix AI plc American Depositary Shares,$33.09,-0.69,-2.043%,1192022347.00,United Kingdom,2020,23855,Health Care,Medical Specialities
RNST,Renasant Corporation Common Stock,$44.09,-0.14,-0.317%,2482891579.00,United States,,37461,Finance,Major Banks
RNWK,RealNetworks Inc. Common Stock,$2.48,-0.02,-0.80%,116330359.00,United States,1997,211629,Technology,EDP Services
ROAD,Construction Partners Inc. Class A Common Stock,$33.00,0.27,0.825%,1725651774.00,United States,2018,39463,Capital Goods,Engineering & Construction
ROCC,Roth CH Acquisition II Co. Common Stock,$9.91,-0.02,-0.201%,145181500.00,United States,2021,7220,,
ROCCW,Roth CH Acquisition II Co. Warrant,$1.37,-0.025,-1.792%,0.00,United States,2021,17154,Finance,Business Services
ROCK,Gibraltar Industries Inc. Common Stock,$76.75,-1.23,-1.577%,2504325331.00,United States,1993,48012,,
ROCR,Roth CH Acquisition III Co. Common stock,$9.71,0.00,0.00%,143542930.00,United States,2021,934,,
ROCRU,Roth CH Acquisition III Co. Unit,$9.89,0.02,0.203%,0.00,United States,2021,1124,,
ROCRW,Roth CH Acquisition III Co. Warrant,$0.92,0.00,0.00%,0.00,United States,2021,14,Finance,Business Services
ROIC,Retail Opportunity Investments Corp. Common Stock (MD),$18.05,-0.32,-1.742%,2143937720.00,United States,,642751,Consumer Services,Real Estate Investment Trusts
ROKU,Roku Inc. Class A Common Stock,$329.40,-10.84,-3.186%,43612093240.00,United States,2017,1241852,Consumer Services,Television Services
ROLL,RBC Bearings Incorporated Common Stock,$197.49,0.41,0.208%,4981893602.00,United States,2005,19621,Capital Goods,Metal Fabrications
ROOT,Root Inc. Class A Common Stock,$9.62,-0.22,-2.236%,2433167475.00,United States,2020,1615046,Finance,Property-Casualty Insurers
ROST,Ross Stores Inc. Common Stock,$120.03,-0.96,-0.793%,42804072464.00,United States,1985,978176,Consumer Services,Clothing/Shoe/Accessory Stores
RPAY,Repay Holdings Corporation Class A Common Stock,$22.99,-0.35,-1.50%,1849445034.00,United States,2018,71086,Technology,EDP Services
RPD,Rapid7 Inc. Common Stock,$81.45,-2.07,-2.478%,4490335405.00,United States,2015,52619,Technology,Computer Software: Prepackaged Software
RPHM,Reneo Pharmaceuticals Inc. Common Stock,$9.40,-1.29,-12.067%,228290778.00,United States,2021,20674,Health Care,Major Pharmaceuticals
RPRX,Royalty Pharma plc Class A Ordinary Shares ,$43.19,0.22,0.512%,26221188961.00,United States,2020,891710,Health Care,Major Pharmaceuticals
RPTX,Repare Therapeutics Inc. Common Shares,$32.085,-0.025,-0.078%,1187167684.00,Canada,2020,262691,,
RRBI,Red River Bancshares Inc. Common Stock,$54.88,-0.37,-0.67%,400911846.00,United States,2019,775,Finance,Commercial Banks
RRGB,Red Robin Gourmet Burgers Inc. Common Stock,$31.30,-1.43,-4.369%,490850012.00,United States,2002,111658,Consumer Services,Restaurants
RRR,Red Rock Resorts Inc. Class A Common Stock,$44.475,-0.235,-0.526%,5201534709.00,United States,2016,203310,Consumer Services,Recreational Products/Toys
RSSS,Research Solutions Inc Common Stock,$2.37,0.01,0.424%,62454259.00,United States,,13623,Technology,Retail: Computer Software & Peripheral Equipment
RSVA,Rodgers Silicon Valley Acquisition Corp. Common Stock,$14.9056,-0.1144,-0.762%,428536000.00,United States,2021,15350,,
RSVAU,Rodgers Silicon Valley Acquisition Corp. Unit,$17.72,0.03,0.17%,0.00,United States,2020,814,,
RSVAW,Rodgers Silicon Valley Acquisition Corp. Warrant,$5.038,-0.012,-0.238%,0.00,United States,2021,2511,Finance,Business Services
RTLR,Rattler Midstream LP Common Units,$11.07,-0.23,-2.035%,1644644893.00,United States,2019,36103,Energy,Oilfield Services/Equipment
RTPY,Reinvent Technology Partners Y Class A Ordinary Shares,$9.83,0.02,0.204%,1201103125.00,United States,2021,1496989,Finance,Business Services
RTPYU,Reinvent Technology Partners Y Unit,$10.01,0.01,0.10%,0.00,United States,2021,23507,Finance,Business Services
RTPYW,Reinvent Technology Partners Y Warrant,$1.54,-0.01,-0.645%,0.00,United States,2021,3229,Finance,Business Services
RUBY,Rubius Therapeutics Inc. Common Stock,$24.04,-0.69,-2.79%,2147175896.00,United States,2018,205773,Health Care,Biotechnology: Biological Products (No Diagnostic Substances)
RUN,Sunrun Inc. Common Stock,$42.295,-0.685,-1.594%,8625207338.00,United States,2015,2437141,Capital Goods,Building Products
RUSHA,Rush Enterprises Inc. Common Stock Cl A,$46.97,-0.35,-0.74%,2610424964.00,United States,,34223,Consumer Services,Other Specialty Stores
RUSHB,Rush Enterprises Inc. Class B,$42.05,-0.51,-1.198%,2336988924.00,United States,,807,Consumer Services,Other Specialty Stores
RUTH,Ruth's Hospitality Group Inc. Common Stock,$22.52,-0.66,-2.847%,773948894.00,United States,2005,116241,Consumer Services,Restaurants
RVMD,Revolution Medicines Inc. Common Stock,$30.135,-0.505,-1.648%,2213192570.00,United States,2020,465716,Consumer Durables,Specialty Chemicals
RVNC,Revance Therapeutics Inc. Common Stock,$28.54,-0.08,-0.28%,2041448134.00,United States,2014,80339,Health Care,Major Pharmaceuticals
RVPH,Reviva Pharmaceuticals Holdings Inc. Common Stock ,$4.97,0.02,0.404%,25518728.00,United States,2020,131156,Health Care,Major Pharmaceuticals
RVPHW,Reviva Pharmaceuticals Holdings Inc. Warrants,$0.4599,0.0301,7.003%,0.00,United States,2018,2151,,
RVSB,Riverview Bancorp Inc Common Stock,$6.94,0.00,0.00%,155117571.00,United States,,8234,Finance,Major Banks
RWLK,ReWalk Robotics Ltd. Ordinary Shares,$1.76,-0.04,-2.222%,81168027.00,Israel,2014,312058,Health Care,Industrial Specialties
RXDX,Prometheus Biosciences Inc. Common Stock,$23.30,0.20,0.866%,905550795.00,United States,2021,35438,Health Care,Major Pharmaceuticals
RXRA,RXR Acquisition Corp. Class A Common Stock,$9.70,0.00,0.00%,418312500.00,United States,2021,13,,
RXRAU,RXR Acquisition Corp. Units,$9.95,0.00,0.00%,0.00,United States,2021,353,,
RXRX,Recursion Pharmaceuticals Inc. Class A Common Stock,$28.87,-0.17,-0.585%,4859419908.00,United States,2021,42977,Health Care,Major Pharmaceuticals
RXT,Rackspace Technology Inc. Common Stock,$20.62,-0.21,-1.008%,4282944960.00,United States,2020,372029,Technology,EDP Services
RYAAY,Ryanair Holdings plc American Depositary Shares,$114.75,-6.34,-5.236%,25893842974.00,Ireland,1997,178086,Transportation,Air Freight/Delivery Services
RYTM,Rhythm Pharmaceuticals Inc. Common Stock,$18.93,-0.36,-1.866%,950413929.00,United States,2017,49946,Health Care,Major Pharmaceuticals
RZLT,Rezolute Inc. Common Stock,$12.519,-0.661,-5.015%,104562156.00,United States,,27905,Health Care,Major Pharmaceuticals
SABR,Sabre Corporation Common Stock,$14.22,-0.57,-3.854%,4542770956.00,United States,2014,2701052,Technology,EDP Services
SABRP,Sabre Corporation 6.50% Series A Mandatory Convertible Preferred Stock,$181.47,-5.28,-2.827%,,United States,,1467,Technology,EDP Services
SAFM,Sanderson Farms Inc. Common Stock,$163.18,-0.14,-0.086%,3643970295.00,United States,1987,55250,,
SAFT,Safety Insurance Group Inc. Common Stock,$83.68,-0.51,-0.606%,1253777273.00,United States,2002,7201,Finance,Property-Casualty Insurers
SAGE,Sage Therapeutics Inc. Common Stock,$66.84,-1.24,-1.821%,3908804403.00,United States,2014,59743,Health Care,Major Pharmaceuticals
SAIA,Saia Inc. Common Stock,$220.78,-2.96,-1.323%,5813952520.00,United States,,36046,Transportation,Trucking Freight/Courier Services
SAII,Software Acquisition Group Inc. II Class A Common Stock,$9.9201,0.0001,0.001%,213902156.00,United States,2020,34896,,
SAIIU,Software Acquisition Group Inc. II Unit,$10.3001,0.0181,0.176%,0.00,United States,2020,575,,
SAIIW,Software Acquisition Group Inc. II Warrant,$1.60,-0.0007,-0.044%,0.00,United States,2020,30401,Finance,Business Services
SAL,Salisbury Bancorp Inc. Common Stock,$47.10,-0.13,-0.275%,134006424.00,United States,,1161,Finance,Savings Institutions
SALM,Salem Media Group Inc. Class A Common Stock,$2.52,-0.06,-2.326%,67710245.00,United States,1999,258752,Consumer Services,Broadcasting
SAMG,Silvercrest Asset Management Group Inc. Class A Common Stock,$16.52,0.13,0.793%,238697612.00,United States,2013,18285,Finance,Investment Managers
SANA,Sana Biotechnology Inc. Common Stock,$20.72,-0.29,-1.38%,3888639427.00,United States,2021,72536,Consumer Durables,Specialty Chemicals
SANM,Sanmina Corporation Common Stock,$42.02,-0.31,-0.732%,2735322491.00,United States,1993,56677,Technology,Electrical Products
SANW,S&W Seed Company Common Stock (NV),$3.565,-0.045,-1.247%,130931851.00,United States,,26160,Miscellaneous,Agricultural Chemicals
SASR,Sandy Spring Bancorp Inc. Common Stock,$47.20,0.20,0.426%,2231080563.00,United States,,19163,Finance,Major Banks
SATS,EchoStar  Corporation Common Stock,$27.39,-0.17,-0.617%,2476275202.00,United States,,129180,Technology,Radio And Television Broadcasting And Communications Equipment
SAVA,Cassava Sciences Inc. Common Stock,$60.6588,-0.0412,-0.068%,2426876941.00,United States,,701800,Health Care,Major Pharmaceuticals
SBAC,SBA Communications Corporation Class A Common Stock,$309.45,-0.16,-0.052%,33836697610.00,United States,1999,239378,Consumer Services,Real Estate Investment Trusts
SBBP,Strongbridge Biopharma plc Ordinary Shares,$2.78,0.14,5.303%,188407047.00,United States,2015,1805810,Health Care,Biotechnology: Biological Products (No Diagnostic Substances)
SBCF,Seacoast Banking Corporation of Florida Common Stock,$36.94,-0.06,-0.162%,2042572181.00,United States,,29901,Finance,Major Banks
SBEA,SilverBox Engaged Merger Corp I Class A Common Stock,$9.78,0.00,0.00%,0.00,United States,2021,8,,
SBEAU,SilverBox Engaged Merger Corp I Units,$9.99,-0.01,-0.10%,0.00,United States,2021,10611,,
